Stock,Symbol
Sabar Flex ,Yearly Results of Sabar Flex India (in Rs. Cr.)
Sabero Organics,Yearly Results of Sabero Organics Gujarat (in Rs. Cr.)
Saboo Brothers,Yearly Results of Saboo Brothers (in Rs. Cr.)
Saboo Sodium,Yearly Results of Saboo Sodium Chloro (in Rs. Cr.)
Sabrimala Indd,Yearly Results of Sabrimala Industries (in Rs. Cr.)
Sacheta Metals,Yearly Results of Sacheta Metals (in Rs. Cr.)
Sachs India,Yearly Results of Sachs India (in Rs. Cr.)
Sadbhav Engg,Yearly Results of Sadbhav Engineering (in Rs. Cr.)
Sadbhav Infra,Yearly Results of Sadbhav Infrastructure Projects (in Rs. Cr.)
Sadhana Nitro,Yearly Results of Sadhana Nitrochem (in Rs. Cr.)
Sadhna Broadcas,Yearly Results of Sadhna Broadcast Ltd (in Rs. Cr.)
Safa Systems,Yearly Results of Safa Systems & Technologies (in Rs. Cr.)
Safal Herbs,Yearly Results of Safal Herbs (in Rs. Cr.)
Safal Sec,Yearly Results of Safal Securities (in Rs. Cr.)
Safari Ind,Yearly Results of Safari Industries (India) (in Rs. Cr.)
Saffron Ind,Yearly Results of Saffron Industries (in Rs. Cr.)
Sagar Cement,Yearly Results of Sagar Cements (in Rs. Cr.)
Sagar Product,Yearly Results of Sagar Productions (in Rs. Cr.)
Sagar Silk,Yearly Results of Sagar Silk Industries (in Rs. Cr.)
Sagar Soya,Yearly Results of Sagar Soya Products (in Rs. Cr.)
Sagar Systech,Yearly Results of Sagar Systech (in Rs. Cr.)
Sagar Tourist,Yearly Results of Sagar Tourist Resorts (in Rs. Cr.)
Sagardeep Alloy,Yearly Results of Sagardeep Alloys (in Rs. Cr.)
Sagarsoft,Yearly Results of Sagarsoft (in Rs. Cr.)
Sah Polymers,Yearly Results of Sah Polymers (in Rs. Cr.)
Sahaj Fashions,Yearly Results of Sahaj Fashions (in Rs. Cr.)
Sahara Housing,Yearly Results of Sahara Housingfina Corporation (in Rs. Cr.)
Sahara Maritime,Yearly Results of Sahara Maritime (in Rs. Cr.)
Sahara One,Yearly Results of Sahara One Media and Entertainment (in Rs. Cr.)
Saheli Leasing,Yearly Results of Saheli Leasing and Industries (in Rs. Cr.)
Sahyadri Ind,Yearly Results of Sahyadri Industries (in Rs. Cr.)
Sai Baba Invest,Yearly Results of Sai Baba Investment And Commercial Enterprises (in Rs. Cr.)
Sai Capital Ltd,Yearly Results of Sai Capital (in Rs. Cr.)
Sai Industries ,Yearly Results of Sai Industries (in Rs. Cr.)
Sai Jeevadhara,Yearly Results of Sai Jeevadhara Finance (in Rs. Cr.)
Sai Silks,Yearly Results of Sai Silks Kalamandir (in Rs. Cr.)
Saianand Comm,Yearly Results of Saianand Commercial (in Rs. Cr.)
SAIL,Yearly Results of Steel Authority of India (in Rs. Cr.)
Sailani Tours,Yearly Results of Sailani Tours N Travels (in Rs. Cr.)
Sainik Finance,Yearly Results of Sainik Finance & Industries (in Rs. Cr.)
Saint-Gobain,Yearly Results of Saint-Gobain Sekurit (in Rs. Cr.)
Saitele,Yearly Results of Sai Television (in Rs. Cr.)
Sajjan Textiles,Yearly Results of Sajjan Textiles Mills (in Rs. Cr.)
Saka,Yearly Results of Saka (in Rs. Cr.)
Sakar Healthcar,Yearly Results of Sakar Healthcare (in Rs. Cr.)
Saksoft,Yearly Results of Saksoft (in Rs. Cr.)
Sakthi Finance,Yearly Results of Sakthi Finance (in Rs. Cr.)
Sakthi Sugars,Yearly Results of Sakthi Sugars (in Rs. Cr.)
Sal Automotive,Yearly Results of Sal Automotive (in Rs. Cr.)
SAL Steel,Yearly Results of SAL Steel (in Rs. Cr.)
Salasar Ext,Yearly Results of Salasar Exteriors & Contour (in Rs. Cr.)
Salasar Techno ,Yearly Results of Salasar Techno Engineering (in Rs. Cr.)
Salem Erode Inv,Yearly Results of Salem Erode Investments (in Rs. Cr.)
Salem Textiles,Yearly Results of Salem Textiles (in Rs. Cr.)
Salguti Ind,Yearly Results of Salguti Industries (in Rs. Cr.)
Salona Cotspin,Yearly Results of Salona Cotspin (in Rs. Cr.)
Salora Inter,Yearly Results of Salora International (in Rs. Cr.)
Salzer Electro,Yearly Results of Salzer Electronics (in Rs. Cr.)
Sam Ind,Yearly Results of Sam Industries (in Rs. Cr.)
Sam Leaseco,Yearly Results of Sam Leaseco (in Rs. Cr.)
Sam-Tul Invest,Yearly Results of Sam-Tul Investments (in Rs. Cr.)
Sambandam Spin,Yearly Results of Sambandam Spinning Mills (in Rs. Cr.)
Sambhaav Media,Yearly Results of Sambhaav Media (in Rs. Cr.)
Samhi Hotels,Yearly Results of Samhi Hotels (in Rs. Cr.)
Samkrg Pistons,Yearly Results of Samkrg Pistons and Rings (in Rs. Cr.)
Samor Reality,Yearly Results of Samor Reality (in Rs. Cr.)
Sampada Chem,Yearly Results of Sampada Chemicals (in Rs. Cr.)
Sampann Utpadan,Yearly Results of Sampann Utpadan India (in Rs. Cr.)
Sampre Nutritio,Yearly Results of Sampre Nutritions (in Rs. Cr.)
Samrat Forgings,Yearly Results of Samrat Forgings (in Rs. Cr.)
Samrat Pharma,Yearly Results of Samrat Pharmachem (in Rs. Cr.)
Samrat Spin,Yearly Results of Samrat Spinners (in Rs. Cr.)
Samruddhi Real,Yearly Results of Samruddhi Realty (in Rs. Cr.)
SAMSRITA LABS,Yearly Results of SAMSRITA LABS (in Rs. Cr.)
Samtel (India),Yearly Results of Samtel (India) (in Rs. Cr.)
Samtel Color,Yearly Results of Samtel Colour (in Rs. Cr.)
Samtex Fashions,Yearly Results of Samtex Fashions (in Rs. Cr.)
Samyak Intl,Yearly Results of Samyak International (in Rs. Cr.)
Sanathnagar Ent,Yearly Results of Sanathnagar Enterprises (in Rs. Cr.)
Sanblue Corp,Yearly Results of Sanblue Corporation (in Rs. Cr.)
Sanchna Trading,Yearly Results of Sanchna Trading & Finance (in Rs. Cr.)
Sancia Global,Yearly Results of Sancia Global Infraprojects (in Rs. Cr.)
Sanco Ind,Yearly Results of Sanco Industries (in Rs. Cr.)
Sanco Trans,Yearly Results of Sanco Trans (in Rs. Cr.)
Sancode Tech,Yearly Results of Sancode Technologies (in Rs. Cr.)
Sand Plast,Yearly Results of Sand Plast (India) (in Rs. Cr.)
Sandesh,Yearly Results of Sandesh (in Rs. Cr.)
Sandhar Technol,Yearly Results of Sandhar Technologies (in Rs. Cr.)
SandS Power,Yearly Results of SandS Power Switchgear (in Rs. Cr.)
Sandu Pharma,Yearly Results of Sandu Pharmaceuticals (in Rs. Cr.)
Sandur Laminate,Yearly Results of Sandur Laminates (in Rs. Cr.)
Sandur Manganes,Yearly Results of Sandur Manganese and Iron Ores (in Rs. Cr.)
Sang Froid Labs,Yearly Results of Sang Froid Labs (India) (in Rs. Cr.)
Sangal Papers,Yearly Results of Sangal Papers (in Rs. Cr.)
Sangam Finserv,Yearly Results of Sangam Finserv (in Rs. Cr.)
Sangam Health,Yearly Results of Sangam Health Care Products (in Rs. Cr.)
Sangam India,Yearly Results of Sangam (India) (in Rs. Cr.)
Sangani HOSP,Yearly Results of Sangani Hospitals (in Rs. Cr.)
Sanghi Corp,Yearly Results of Sanghi Corporate Services (in Rs. Cr.)
Sanghi Ind,Yearly Results of Sanghi Industries (in Rs. Cr.)
Sanghi Polyeste,Yearly Results of Sanghi Polyesters (in Rs. Cr.)
Sanghvi Asbesto,Yearly Results of Sanghvi Asbestos Cements (in Rs. Cr.)
Sanghvi Brands ,Yearly Results of Sanghvi Brands Promoters (in Rs. Cr.)
Sanghvi Forging,Yearly Results of Sanghvi Forging and Engineering (in Rs. Cr.)
Sanghvi Movers,Yearly Results of Sanghvi Movers (in Rs. Cr.)
Sanginita Chemi,Yearly Results of Sanginita Chemicals (in Rs. Cr.)
Sanguine Media ,Yearly Results of Sanguine Media (in Rs. Cr.)
Sanjivani Paren,Yearly Results of Sanjivani Parenteral (in Rs. Cr.)
Sankhya Infotec,Yearly Results of Sankhya Infotech (in Rs. Cr.)
Sanmit Infra,Yearly Results of Sanmit Infra (in Rs. Cr.)
Sanmitra Commer,Yearly Results of Sanmitra Commercial (in Rs. Cr.)
Sanofi India,Yearly Results of Sanofi India (in Rs. Cr.)
Sanraa Media,Yearly Results of Sanraa Media (in Rs. Cr.)
Sanrhea Tech,Yearly Results of Sanrhea Technical Textile (in Rs. Cr.)
Sansera Eng,Yearly Results of Sansera Engineering (in Rs. Cr.)
Santogen Export,Yearly Results of Santogen Exports (in Rs. Cr.)
Santosh Fine-Fa,Yearly Results of Santosh Fine-Fab (in Rs. Cr.)
Santosh Industr,Yearly Results of Santosh Industries Ltd (in Rs. Cr.)
Santowin Corp,Yearly Results of Santowin Corporation (in Rs. Cr.)
Sanwaria Consum,Yearly Results of Sanwaria Consumer (in Rs. Cr.)
Sanyo Impex,Yearly Results of Sanyo Impex (in Rs. Cr.)
Sapan Chemicals,Yearly Results of Sapan Chemicals (in Rs. Cr.)
Sapphire Foods,Yearly Results of Sapphire Foods India (in Rs. Cr.)
Saptak Chem ,Yearly Results of Saptak Chem And Business (in Rs. Cr.)
Saptarishi Agro,Yearly Results of Saptarishi Agro Industries (in Rs. Cr.)
SAR Auto Prod,Yearly Results of SAR Auto Products (in Rs. Cr.)
SAR Televenture,Yearly Results of SAR Televenture (in Rs. Cr.)
Saraf Sons,Yearly Results of Saraf Sons (Traders) (in Rs. Cr.)
Sarang Chem,Yearly Results of Sarang Chemicals (in Rs. Cr.)
Saraswati Comm,Yearly Results of Saraswati Commercial (India) (in Rs. Cr.)
Sarda Energy,Yearly Results of Sarda Energy and Minerals (in Rs. Cr.)
Sarda Info,Yearly Results of Sarda Information Technology (in Rs. Cr.)
Sarda Proteins ,Yearly Results of Sarda Proteins (in Rs. Cr.)
Saregama India,Yearly Results of Saregama India (in Rs. Cr.)
Sarika Paint,Yearly Results of Sarika Paints (in Rs. Cr.)
Sarla Performan,Yearly Results of Sarla Performance Fibers (in Rs. Cr.)
Saroja Pharma,Yearly Results of Saroja Pharma Industries India (in Rs. Cr.)
Sarthak Global,Yearly Results of Sarthak Global (in Rs. Cr.)
Sarthak Ind,Yearly Results of Sarthak Industries (in Rs. Cr.)
Sarthak Metals,Yearly Results of Sarthak Metals (in Rs. Cr.)
Sarup Ind,Yearly Results of Sarup Industries (in Rs. Cr.)
Sarvamangal Mer,Yearly Results of Sarvamangal Mercantile Co. (in Rs. Cr.)
Sarveshwar Food,Yearly Results of Sarveshwar Foods (in Rs. Cr.)
Sarvottam Fin,Yearly Results of Sarvottam Finvest (in Rs. Cr.)
Sashwat Tech,Yearly Results of Sashwat Technocrats (in Rs. Cr.)
Sasken Tech,Yearly Results of Sasken Technologies (in Rs. Cr.)
Sasta Sundar,Yearly Results of Sasta Sundar Ventures (in Rs. Cr.)
Sat Ind,Yearly Results of Sat Industries (in Rs. Cr.)
SATCHMO HOLD,Yearly Results of SATCHMO HOLDINGS (in Rs. Cr.)
Satellite Engg,Yearly Results of Satellite Engineering (in Rs. Cr.)
Satellite Info,Yearly Results of Satellite Infoconcepts (in Rs. Cr.)
Satguru Agro,Yearly Results of Satguru Agro Industries (in Rs. Cr.)
Satia Ind,Yearly Results of Satia Industries (in Rs. Cr.)
Satiate Agri,Yearly Results of Satiate Agri (in Rs. Cr.)
Satin Credit,Yearly Results of Satin Creditcare Network (in Rs. Cr.)
Satkar Elec,Yearly Results of Satkar Electronics (in Rs. Cr.)
Satkar Finlease,Yearly Results of Satkar Finlease (in Rs. Cr.)
Satra Prop,Yearly Results of Satra Properties India (in Rs. Cr.)
Satvahana Ispat,Yearly Results of Sathavahana Ispat (in Rs. Cr.)
Satya Miners,Yearly Results of Satya Miners & Transporters (in Rs. Cr.)
Satyam Silk,Yearly Results of Satyam Silk (in Rs. Cr.)
Saumya Capital,Yearly Results of Saumya Capital (in Rs. Cr.)
Saumya Consult,Yearly Results of Saumya Consultants (in Rs. Cr.)
Saurashtra Cem,Yearly Results of Saurashtra Cement (in Rs. Cr.)
Saurashtra Pape,Yearly Results of Saurashtra Paper (in Rs. Cr.)
Savani Financia,Yearly Results of Savani Financial (in Rs. Cr.)
Savant Infocomm,Yearly Results of Savant Infocomm (in Rs. Cr.)
Saven Tech,Yearly Results of Saven Technologies (in Rs. Cr.)
Savera Ind,Yearly Results of Savera Industries (in Rs. Cr.)
Savita Oil Tech,Yearly Results of Savita Oil Technologies (in Rs. Cr.)
Sawaca Business,Yearly Results of Sawaca Business Machines (in Rs. Cr.)
Sawant Foods,Yearly Results of Sawant Foods Products (in Rs. Cr.)
Sayaji Hotels,Yearly Results of Sayaji Hotels (in Rs. Cr.)
Sayaji Industri,Yearly Results of Sayaji Industries (in Rs. Cr.)
SBandT Intl,Yearly Results of SBandT International (in Rs. Cr.)
SBC Exports,Yearly Results of SBC Exports (in Rs. Cr.)
SBEC Sugars,Yearly Results of SBEC Sugars (in Rs. Cr.)
SBEC Systems,Yearly Results of SBEC Systems (India) (in Rs. Cr.)
SBI,Yearly Results of State Bank of India (in Rs. Cr.)
SBI Card,Yearly Results of SBI Cards & Payment Services (in Rs. Cr.)
SBI Home Financ,Yearly Results of SBI Home Finance (in Rs. Cr.)
SBI Life Insura,Yearly Results of SBI Life Insurance Company (in Rs. Cr.)
SBL Industries,Yearly Results of SBL Industries (in Rs. Cr.)
SBL Infratech,Yearly Results of SBL Infratech (in Rs. Cr.)
SC Agrotech,Yearly Results of SC Agrotech (in Rs. Cr.)
Scan Organics,Yearly Results of Scan Organics (in Rs. Cr.)
Scan Projects,Yearly Results of Scan Projects (in Rs. Cr.)
Scan Steels,Yearly Results of Scan Steels (in Rs. Cr.)
Scanpoint Geo,Yearly Results of Scanpoint Geomatics (in Rs. Cr.)
Scarnose Intl.,Yearly Results of Scarnose International (in Rs. Cr.)
Schablona India,Yearly Results of Schablona India (in Rs. Cr.)
Schaeffler Ind,Yearly Results of Schaeffler India (in Rs. Cr.)
Schneider Infra,Yearly Results of Schneider Electric Infrastructure (in Rs. Cr.)
Schneider Pres,Yearly Results of Schneider Electric President Systems (in Rs. Cr.)
Scindia Steam,Yearly Results of Scindia Steam Navigation Company (in Rs. Cr.)
Scintilla Comme,Yearly Results of Scintilla Commercial & Credit (in Rs. Cr.)
Scintilla Soft,Yearly Results of Scintilla Software Technology. (in Rs. Cr.)
Scoobee Day,Yearly Results of Scoobee Day Garments (India) (in Rs. Cr.)
Scooters India,Yearly Results of Scooters India (in Rs. Cr.)
Scope Ind,Yearly Results of Scope Industries (India) (in Rs. Cr.)
SCSL,Yearly Results of SPA Capital Services Limited (in Rs. Cr.)
SDC Tech,Yearly Results of SDC Techmedia (in Rs. Cr.)
SDL,Yearly Results of Sagar Diamonds Limited (in Rs. Cr.)
Sea TV Network,Yearly Results of Sea TV Network (in Rs. Cr.)
SEACOAST SS,Yearly Results of SEACOAST SHIPPING SERVICES (in Rs. Cr.)
Seagull Leafin,Yearly Results of Seagull Leafin (in Rs. Cr.)
Sealmatic India,Yearly Results of Sealmatic India (in Rs. Cr.)
Seamec,Yearly Results of Seamec (in Rs. Cr.)
Seasons Furnish,Yearly Results of Seasons Furnishings (in Rs. Cr.)
Seasons Textile,Yearly Results of Seasons Textiles (in Rs. Cr.)
SecMark Consult,Yearly Results of SecMark Consultancy (in Rs. Cr.)
Secunbad Health,Yearly Results of Secunderabad Healthcare (in Rs. Cr.)
SecUR Credentia,Yearly Results of SecUR Credentials (in Rs. Cr.)
Secure Earth,Yearly Results of Secure Earth Technologies (in Rs. Cr.)
Securekloud Tec,Yearly Results of Securekloud Technologies (in Rs. Cr.)
Sejal Glass,Yearly Results of Sejal Glass (in Rs. Cr.)
SEL,Yearly Results of SAKUMA EXPORTS LTD. (in Rs. Cr.)
SEL Mgf Company,Yearly Results of SEL Manufacturing Company (in Rs. Cr.)
Selan Explore,Yearly Results of Selan Exploration Technology (in Rs. Cr.)
Sellwin Traders,Yearly Results of Sellwin Traders (in Rs. Cr.)
SEMAC CONSULT,Yearly Results of SEMAC CONSULTANTS (in Rs. Cr.)
Senbo Ind,Yearly Results of Senbo Industries (in Rs. Cr.)
Senthil Infotek,Yearly Results of Senthil Infotek (in Rs. Cr.)
SEPC,Yearly Results of SEPC (in Rs. Cr.)
Sequel e-Router,Yearly Results of Sequel e-Routers (in Rs. Cr.)
Sequent Scienti,Yearly Results of Sequent Scientific (in Rs. Cr.)
SER Industries,Yearly Results of SER Industries (in Rs. Cr.)
Sera Investment,Yearly Results of Sera Investments & Finance India (in Rs. Cr.)
Servalakshmi,Yearly Results of Servalakshmi Paper (in Rs. Cr.)
Service Care,Yearly Results of Service Care (in Rs. Cr.)
Servotech Ent,Yearly Results of Servotech Enterprises (in Rs. Cr.)
Servotech Power,Yearly Results of Servotech Power Systems (in Rs. Cr.)
Seshasayee Pape,Yearly Results of Seshasayee Paper and Boards (in Rs. Cr.)
Setco Auto,Yearly Results of Setco Automotive (in Rs. Cr.)
Setubandhan Inf,Yearly Results of Setubandhan Infrastructure (in Rs. Cr.)
Seven Hill Ind.,Yearly Results of Seven Hill Industries (in Rs. Cr.)
Seya Industries,Yearly Results of Seya Industries (in Rs. Cr.)
SFL Int,Yearly Results of SFL International (in Rs. Cr.)
SG FINSERVE,Yearly Results of SG FINSERVE (in Rs. Cr.)
SG Global Expor,Yearly Results of SG Global Exports. (in Rs. Cr.)
SG MART,Yearly Results of SG MART (in Rs. Cr.)
SGN Cable,Yearly Results of SGN Cable Industries (in Rs. Cr.)
Shah Alloys,Yearly Results of Shah Alloys (in Rs. Cr.)
Shah Construct,Yearly Results of Shah Construction Company (in Rs. Cr.)
Shah Foods,Yearly Results of Shah Foods (in Rs. Cr.)
SHAH METACORP,Yearly Results of SHAH METACORP (in Rs. Cr.)
Shahi Shipping,Yearly Results of Shahi Shipping (in Rs. Cr.)
Shailja Comm.,Yearly Results of Shailja Commercial Trade Frenzy (in Rs. Cr.)
Shaily Engg,Yearly Results of Shaily Engineering Plastics (in Rs. Cr.)
Shaival Reality,Yearly Results of Shaival Reality (in Rs. Cr.)
Shakti Press,Yearly Results of Shakti Press (in Rs. Cr.)
Shakti Pumps,Yearly Results of Shakti Pumps (India) (in Rs. Cr.)
Shalby ,Yearly Results of Shalby (in Rs. Cr.)
Shalibhadra Fin,Yearly Results of Shalibhadra Finance (in Rs. Cr.)
Shalimar Agenci,Yearly Results of Shalimar Agencies (in Rs. Cr.)
Shalimar Paints,Yearly Results of Shalimar Paints (in Rs. Cr.)
Shalimar Prod,Yearly Results of Shalimar Productions (in Rs. Cr.)
Shalimar Wires,Yearly Results of Shalimar Wires Industries (in Rs. Cr.)
Shamken Cotsyn,Yearly Results of Shamken Cotsyn (in Rs. Cr.)
Shamken Multifa,Yearly Results of Shamken Mutifab (in Rs. Cr.)
Shamken Spinner,Yearly Results of Shamken Spinners (in Rs. Cr.)
Shamrock Ind,Yearly Results of Shamrock Industrial Corporation (in Rs. Cr.)
Shangar Decor,Yearly Results of Shangar Decor (in Rs. Cr.)
Shankar Lal Ram,Yearly Results of Shankar Lal Rampal Dye-Chem (in Rs. Cr.)
Shankara Buildi,Yearly Results of Shankara Building Products (in Rs. Cr.)
Shantai Industr,Yearly Results of Shantai Industries (in Rs. Cr.)
Shantanu Sheo,Yearly Results of Shantanu Sheorey Aqua (in Rs. Cr.)
Shanthala,Yearly Results of Shanthala FMCG Products (in Rs. Cr.)
Shanthi Gears,Yearly Results of Shanthi Gears (in Rs. Cr.)
Shanti Educatio,Yearly Results of Shanti Educational Initiatives Limited (in Rs. Cr.)
Shanti Overseas,Yearly Results of Shanti Overseas (India) (in Rs. Cr.)
Shanti Pharma,Yearly Results of Shanti Pharmacetucial Laboratories (in Rs. Cr.)
Shanti Spintex,Yearly Results of Shanti Spintex (in Rs. Cr.)
Shantidoot Infr,Yearly Results of Shantidoot Infra Services (in Rs. Cr.)
Shantivij Jewel,Yearly Results of Shantivijay Jewels (in Rs. Cr.)
Sharanam Infra,Yearly Results of Sharanam Infraproject and Trading (in Rs. Cr.)
Sharat Ind,Yearly Results of Sharat Industries (in Rs. Cr.)
Sharda Crop,Yearly Results of Sharda Cropchem (in Rs. Cr.)
Sharda Ispat,Yearly Results of Sharda Ispat (in Rs. Cr.)
Sharda Motor,Yearly Results of Sharda Motor Industries (in Rs. Cr.)
Shardul Sec,Yearly Results of Shardul Securities (in Rs. Cr.)
Share India,Yearly Results of Share India Securities (in Rs. Cr.)
Sharika Enter,Yearly Results of Sharika Enterprises (in Rs. Cr.)
Sharma East Ind,Yearly Results of Sharma East India Hosp and Medical Research (in Rs. Cr.)
Sharon Bio Medi,Yearly Results of Sharon Bio Medicine (in Rs. Cr.)
Sharp Chucks,Yearly Results of Sharp Chucks And Machines (in Rs. Cr.)
Sharp India,Yearly Results of Sharp India (in Rs. Cr.)
Sharp Industrie,Yearly Results of Sharp Industries (in Rs. Cr.)
Sharp Invest,Yearly Results of Sharp Investments (in Rs. Cr.)
Sharpline Broad,Yearly Results of Sharpline Broadcast (in Rs. Cr.)
Sharpscan Print,Yearly Results of Sharpscan and Prints (in Rs. Cr.)
Shashank Trader,Yearly Results of Shashank Traders (in Rs. Cr.)
Shashijit Infra,Yearly Results of Shashijit Infraprojects (in Rs. Cr.)
Shashwat Furnis,Yearly Results of Shashwat Furnishing Solutions (in Rs. Cr.)
Shasun Pharma,Yearly Results of Shasun Pharmaceuticals (in Rs. Cr.)
Shayona Petro,Yearly Results of Shayona Petrochem (in Rs. Cr.)
Sheela Foam,Yearly Results of Sheela Foam (in Rs. Cr.)
Sheetal Cool Pr,Yearly Results of Sheetal Cool Products (in Rs. Cr.)
Sheetal Diamond,Yearly Results of Sheetal Diamonds (in Rs. Cr.)
Sheetal Sec,Yearly Results of Sheetal Securities Finance (in Rs. Cr.)
Sheetal Univers,Yearly Results of Sheetal Universal (in Rs. Cr.)
Shekhawati Poly,Yearly Results of Shekhawati Poly-Yarn (in Rs. Cr.)
Shell Infotech,Yearly Results of Shell Infotech (in Rs. Cr.)
Shelter Infra,Yearly Results of Shelter Infra Projects (in Rs. Cr.)
Shemaroo Ent,Yearly Results of Shemaroo Entertainment (in Rs. Cr.)
Shentracon Chem,Yearly Results of Shentracon Chemicals (in Rs. Cr.)
Shera Energy,Yearly Results of Shera Energy (in Rs. Cr.)
Sheraton Pro,Yearly Results of Sheraton Properties (in Rs. Cr.)
Shervani Indust,Yearly Results of Shervani Industrial Syndicate (in Rs. Cr.)
Sheshadri Ind,Yearly Results of Sheshadri Industries (in Rs. Cr.)
Shetron,Yearly Results of Shetron (in Rs. Cr.)
Shigan Quantum,Yearly Results of Shigan Quantum Technologies (in Rs. Cr.)
Shikhar Consult,Yearly Results of Shikhar Consultants. (in Rs. Cr.)
Shikhar Leasing,Yearly Results of Shikhar Leasing & Trading (in Rs. Cr.)
Shilchar Techno,Yearly Results of Shilchar Technologies (in Rs. Cr.)
Shilp Gravures,Yearly Results of Shilp Gravures (in Rs. Cr.)
Shilpa,Yearly Results of Shilpa Medicare (in Rs. Cr.)
Shilpax Lab,Yearly Results of Shilpax Laboratories (in Rs. Cr.)
Shilpi Cable,Yearly Results of Shilpi Cable Technologies (in Rs. Cr.)
Shine,Yearly Results of Satkar Finlease (in Rs. Cr.)
Shipping Corp,Yearly Results of Shipping Corporation of India (in Rs. Cr.)
Shirpur Gold,Yearly Results of Shirpur Gold Refinery (in Rs. Cr.)
Shish Industrie,Yearly Results of Shish Industries (in Rs. Cr.)
Shiv Aum Steels,Yearly Results of Shiv Aum Steels (in Rs. Cr.)
Shiva Cement,Yearly Results of Shiva Cement (in Rs. Cr.)
Shiva Global,Yearly Results of Shiva Global Agro Industries (in Rs. Cr.)
Shiva Granito E,Yearly Results of Shiva Granito Export (in Rs. Cr.)
Shiva Mills Lim,Yearly Results of Shiva Mills Limited (in Rs. Cr.)
Shiva Paper,Yearly Results of Shiva Paper Mills (in Rs. Cr.)
Shiva Suitings,Yearly Results of Shiva Suitings (in Rs. Cr.)
Shiva Texyarn,Yearly Results of Shiva Texyarn (in Rs. Cr.)
Shivagrico Impl,Yearly Results of Shivagrico Implements (in Rs. Cr.)
Shivalik Bimeta,Yearly Results of Shivalik Bimetal Controls (in Rs. Cr.)
Shivalik Rasa,Yearly Results of Shivalik Rasayan (in Rs. Cr.)
Shivam Auto,Yearly Results of Shivam Autotech (in Rs. Cr.)
Shivamshree Bus,Yearly Results of Shivamshree Businesses (in Rs. Cr.)
Shivani Vanas,Yearly Results of Shivani Vanaspati (in Rs. Cr.)
Shivansh Finser,Yearly Results of Shivansh Finserv (in Rs. Cr.)
Shivkamal Impex,Yearly Results of Shivkamal Impex Limited (in Rs. Cr.)
Shivom Investme,Yearly Results of Shivom Investment & Consultancy (in Rs. Cr.)
Shonkh Tech,Yearly Results of Shonkh Technologies International (in Rs. Cr.)
Shoora Designs,Yearly Results of Shoora Designs (in Rs. Cr.)
Shoppers Stop,Yearly Results of Shoppers Stop (in Rs. Cr.)
Shraddha Prime,Yearly Results of Shraddha Prime Projects (in Rs. Cr.)
Shradha AI Tech,Yearly Results of Shradha AI Technologies (in Rs. Cr.)
Shradha Infra,Yearly Results of Shradha Infraprojects (in Rs. Cr.)
Shree Ajit Pulp,Yearly Results of Shree Ajit Pulp and Paper (in Rs. Cr.)
Shree Ambeshwar,Yearly Results of Shree Ambeshwar Paper Mill (in Rs. Cr.)
Shree Benzophen,Yearly Results of Shree Benzophen Industries (in Rs. Cr.)
Shree Bhavya,Yearly Results of Shree Bhavya Fabrics (in Rs. Cr.)
Shree Cements,Yearly Results of Shree Cements (in Rs. Cr.)
Shree Digvijay,Yearly Results of Shree Digvijay Cement Company (in Rs. Cr.)
Shree Ganesh,Yearly Results of Shree Ganesh Knit (in Rs. Cr.)
Shree Ganesh Re,Yearly Results of Shree Ganesh Remedies (in Rs. Cr.)
Shree Hanuman,Yearly Results of Shree Hanuman Sugar & Industries (in Rs. Cr.)
Shree Hari Chem,Yearly Results of Shree Hari Chemical Exports (in Rs. Cr.)
Shree Jagdambe ,Yearly Results of Shree Jagdambe Paper Mills (in Rs. Cr.)
Shree Karthik P,Yearly Results of Shree Karthik Paper (in Rs. Cr.)
Shree Kr Paper,Yearly Results of Shree Krishna Paper Mills and Industries (in Rs. Cr.)
Shree Krishna,Yearly Results of Shree Krishna Infrastructure (in Rs. Cr.)
Shree Metalloys,Yearly Results of Shree Metalloys (in Rs. Cr.)
Shree Mfg Co,Yearly Results of Shree Manufacturing Company (in Rs. Cr.)
Shree Narmada,Yearly Results of Shree Narmada Aluminium Industries (in Rs. Cr.)
Shree Nath Comm,Yearly Results of Shree Nath Commercial & Finance (in Rs. Cr.)
Shree Nidhi Tra,Yearly Results of Shree Nidhi Trading (in Rs. Cr.)
Shree OSFM,Yearly Results of Shree OSFM E-Mobility (in Rs. Cr.)
Shree Pacetroni,Yearly Results of Shree Pacetronix (in Rs. Cr.)
Shree Pomani,Yearly Results of Shree Pomani Metals and Alloys. (in Rs. Cr.)
Shree Precoated,Yearly Results of Shree Precoated Steels (in Rs. Cr.)
Shree Pushkar,Yearly Results of Shree Pushkar Chemicals and Fertilisers (in Rs. Cr.)
Shree Rajasthan,Yearly Results of Shree Rajasthan Syntex (in Rs. Cr.)
Shree Rajesh Pa,Mar '20
Shree Ram Prot,Yearly Results of Shree Ram Proteins (in Rs. Cr.)
Shree Ram Urban,Yearly Results of Shree Ram Urban Infrastructure (in Rs. Cr.)
Shree Rama News,Yearly Results of Shree Rama Newsprint (in Rs. Cr.)
Shree Rang Mark,Yearly Results of Shree Rang Mark Travels (in Rs. Cr.)
Shree Rani Sati,Yearly Results of Shree Rani Sati (in Rs. Cr.)
Shree Renuka,Yearly Results of Shree Renuka Sugars (in Rs. Cr.)
Shree Salasar,Yearly Results of Shree Salasar Investments (in Rs. Cr.)
Shree Secu,Yearly Results of Shree Securities (in Rs. Cr.)
Shree Shaleen,Yearly Results of Shree Shaleen Textiles (in Rs. Cr.)
Shree Steel Wir,Yearly Results of Shree Steel Wire Ropes (in Rs. Cr.)
Shree Synthetic,Yearly Results of Shree Synthetics (in Rs. Cr.)
Shree Tirupati ,Yearly Results of Shree Tirupati Balajee FIBC (in Rs. Cr.)
Shree Tulsi,Yearly Results of Shree Tulsi Online.Com (in Rs. Cr.)
Shree Vasu,Yearly Results of Shree Vasu Logistics (in Rs. Cr.)
Shree Vindhya,Yearly Results of Shree Vindhya Paper Mills (in Rs. Cr.)
Shree Yaax Phar,Yearly Results of Shree Yaax Pharmaceutical & Cosmetics (in Rs. Cr.)
ShreeGanesh Bio,Yearly Results of Shree Ganesh Biotech (India) Ltd (in Rs. Cr.)
Shreejal Info,Yearly Results of Shreejal Info Hubs (in Rs. Cr.)
Shreeji Dychem ,Yearly Results of Shreeji Dychem (in Rs. Cr.)
Shreeji Phospha,Yearly Results of Shreeji Phosphate (in Rs. Cr.)
