Stock,Symbol
Enkay Texo Ind,Yearly Results of Enkay Texofood Industries (in Rs. Cr.)
Enkei Wheels,Yearly Results of Enkei Wheels (India) (in Rs. Cr.)
Ennore Coke,Yearly Results of Ennore Coke (in Rs. Cr.)
Ensa Steel,Yearly Results of Ensa Steel and Developers (in Rs. Cr.)
Enso Secutrack,Yearly Results of Enso Secutrack (in Rs. Cr.)
Ent Network Ind,Yearly Results of Entertainment Network India (in Rs. Cr.)
Entegra,Yearly Results of Entegra (in Rs. Cr.)
Enterprise Intl,Yearly Results of Enterprises International (in Rs. Cr.)
Envair Electro,Yearly Results of Envair Electrodyne (in Rs. Cr.)
Enviro-Clean,Yearly Results of Enviro-Clean Systems (in Rs. Cr.)
Eon Electric,Yearly Results of Eon Electric (in Rs. Cr.)
Eonour Tech,Yearly Results of Eonour Technologies (in Rs. Cr.)
EP Biocompo,Yearly Results of EP Biocomposites (in Rs. Cr.)
EPIC Energy,Yearly Results of EPIC Energy (in Rs. Cr.)
Epic Enzymers,Yearly Results of Epic Enzymers Pharmaceuticals and Industrial Chem (in Rs. Cr.)
Epigral,Yearly Results of Epigral (in Rs. Cr.)
EPL,Yearly Results of EPL (in Rs. Cr.)
Epsom Prop,Yearly Results of Epsom Properties (in Rs. Cr.)
EQUIPPP,Yearly Results of Equippp Social Impact Technologies (in Rs. Cr.)
Equitas Bank,Yearly Results of Equitas Small Finance Bank (in Rs. Cr.)
Equitas Holding,Yearly Results of Equitas Holdings (in Rs. Cr.)
Era Buildsys,Yearly Results of Era Buildsys (in Rs. Cr.)
Era Infra Eng,Yearly Results of Era Infra Engineering (in Rs. Cr.)
Eris Life,Yearly Results of Eris Lifesciences (in Rs. Cr.)
Eros Intl,Yearly Results of Eros International Media (in Rs. Cr.)
ERP Soft System,Yearly Results of ERP Soft Systems (in Rs. Cr.)
Esaar (India),Yearly Results of Esaar (India) (in Rs. Cr.)
Esab India,Yearly Results of Esab India (in Rs. Cr.)
ESAF SFB,Yearly Results of ESAF Small Finance Bank (in Rs. Cr.)
Escorp Asset Ma,Yearly Results of Escorp Asset Management (in Rs. Cr.)
Escorts Kubota,Yearly Results of Escorts Kubota (in Rs. Cr.)
Esha Media,Yearly Results of Esha Media Research (in Rs. Cr.)
Eskay Knit,Yearly Results of Eskay Knit (in Rs. Cr.)
Espire Hospital,Yearly Results of Espire Hospitality (in Rs. Cr.)
Esquire Money,Yearly Results of Esquire Money Guarantees (in Rs. Cr.)
ESS DEE,Yearly Results of ESS DEE Aluminium (in Rs. Cr.)
Essar Oil,Yearly Results of Essar Oil (in Rs. Cr.)
Essar Ports,Yearly Results of Essar Ports (in Rs. Cr.)
Essar Sec,Yearly Results of Essar Securities (in Rs. Cr.)
Essar Shipping,Yearly Results of Essar Shipping (in Rs. Cr.)
Essjay Syntheti,Yearly Results of Essjay Synthetics (in Rs. Cr.)
Esskay Tele,Yearly Results of Esskay Telecom (in Rs. Cr.)
Esteem Bio,Yearly Results of Esteem Bio Organic Food Processing (in Rs. Cr.)
Ester Ind,Yearly Results of Ester Industries (in Rs. Cr.)
Ethos,Yearly Results of Ethos (in Rs. Cr.)
ETP Corporation,Yearly Results of ETP Corporation (in Rs. Cr.)
ETT,Yearly Results of ETT (in Rs. Cr.)
Eupharma Labs,Yearly Results of Eupharma Laboratories (in Rs. Cr.)
Eureka Forbes,Yearly Results of Eureka Forbes (in Rs. Cr.)
Eureka Ind,Yearly Results of Eureka Industries (in Rs. Cr.)
Euro Ceramics,Yearly Results of Euro Ceramics (in Rs. Cr.)
Euro India Fres,Yearly Results of Euro India Fresh Foods (in Rs. Cr.)
Euro Leder,Yearly Results of Euro Leder Fashion (in Rs. Cr.)
Euro Leder Fash,Yearly Results of Euro Leder Fashion (in Rs. Cr.)
Euro Panel,Yearly Results of Euro Panel Products (in Rs. Cr.)
EuroMult,Yearly Results of Euro Multivision (in Rs. Cr.)
European Soft,Yearly Results of European Software Alliances (in Rs. Cr.)
Eurotex,Yearly Results of Eurotex Industries and Exports (in Rs. Cr.)
Evans Electric,Yearly Results of Evans Electric (in Rs. Cr.)
Eveready Ind,Yearly Results of Eveready Industries India (in Rs. Cr.)
Everest Ind,Yearly Results of Everest Industries (in Rs. Cr.)
Everest Kanto,Yearly Results of Everest Kanto Cylinder (in Rs. Cr.)
Everest Organic,Yearly Results of Everest Organics (in Rs. Cr.)
EVERFIN,Yearly Results of EVERLON FINANCIALS (in Rs. Cr.)
Evergreen Tex,Yearly Results of Evergreen Textiles (in Rs. Cr.)
Everonn Edu,Yearly Results of Everonn Education (in Rs. Cr.)
Evexia Lifecare,Yearly Results of Evexia Lifecare (in Rs. Cr.)
Evinix,Yearly Results of Evinix Accessories (in Rs. Cr.)
Evoq Remedies,Yearly Results of Evoq Remedies (in Rs. Cr.)
Excel,Yearly Results of Excel Industries (in Rs. Cr.)
Excel Castronic,Yearly Results of Excel Castronics (in Rs. Cr.)
Excel Crop Care,Yearly Results of Excel Crop Care (in Rs. Cr.)
Excel Glasses,Yearly Results of Excel Glasses (in Rs. Cr.)
Excel Realty,Yearly Results of Excel Realty N Infra (in Rs. Cr.)
Exdon Trading,Yearly Results of Exdon Trading Company (in Rs. Cr.)
Exedy India,Yearly Results of Exedy India (in Rs. Cr.)
Exelon Infra,Yearly Results of Exelon Infrastructure (in Rs. Cr.)
Exhicon Events,Yearly Results of Exhicon Events Media Solutions (in Rs. Cr.)
Exide Ind,Yearly Results of Exide Industries (in Rs. Cr.)
Exotic Coal,Yearly Results of Exotic Coal (in Rs. Cr.)
Expleo Solution,Yearly Results of Expleo Solutions (in Rs. Cr.)
ExplicitFinance,Yearly Results of Explicit Finance (in Rs. Cr.)
Expo Gas Cont,Yearly Results of Expo Gas Containers (in Rs. Cr.)
Extol Comm,Yearly Results of Extol Commercial (in Rs. Cr.)
Exxaro Tiles,Yearly Results of Exxaro Tiles (in Rs. Cr.)
EYANTRA VENTURE,Yearly Results of EYANTRA VENTURES (in Rs. Cr.)
F Mec Intl.,Yearly Results of F Mec International Financial Services (in Rs. Cr.)
Fabino Life,Yearly Results of Fabino Life Sciences (in Rs. Cr.)
Facor Alloys,Yearly Results of Facor Alloys (in Rs. Cr.)
Facor Steels,Yearly Results of Facor Steels (in Rs. Cr.)
Fact Enterprise,Yearly Results of Fact Enterprise (in Rs. Cr.)
Fairchem Org.,Yearly Results of Fairchem Organics (in Rs. Cr.)
Fairdeal Fila,Yearly Results of Fairdeal Filaments (in Rs. Cr.)
Fairfield Atlas,Yearly Results of Fairfield Atlas (in Rs. Cr.)
Falcon Tyres,Yearly Results of Falcon Tyres (in Rs. Cr.)
Fame India,Yearly Results of Fame India (in Rs. Cr.)
Family Care Hos,Yearly Results of Family Care Hospitals (in Rs. Cr.)
Farmax India,Yearly Results of Farmax India (in Rs. Cr.)
Fast Track,Yearly Results of Fast Track Entertainment (in Rs. Cr.)
Faze Three,Yearly Results of Faze Three (in Rs. Cr.)
Faze Three Auto,Yearly Results of Faze Three Autofab (in Rs. Cr.)
FCS Software,Yearly Results of FCS Software Solutions (in Rs. Cr.)
FDC,Yearly Results of FDC (in Rs. Cr.)
FE (India),Yearly Results of FE (India) (in Rs. Cr.)
Fedbank Financi,Yearly Results of Fedbank Financial Services (in Rs. Cr.)
Fedders Elec,Yearly Results of Fedders Electric and Engineering (in Rs. Cr.)
Federal Bank,Yearly Results of Federal Bank (in Rs. Cr.)
Federal-Mogul,Yearly Results of Federal-Mogul Goetze (in Rs. Cr.)
Felix Industrie,Yearly Results of Felix Industries (in Rs. Cr.)
Fenoplast,Yearly Results of Fenoplast (in Rs. Cr.)
Fermenta Bio,Yearly Results of Fermenta Biotech (in Rs. Cr.)
Ferro Alloys,Yearly Results of Ferro Alloys Corporation (in Rs. Cr.)
Fert and Chem,Yearly Results of Fertilisers and Chemicals Travancore (in Rs. Cr.)
Fervent Synergi,Yearly Results of Fervent Synergies (in Rs. Cr.)
FGP,Yearly Results of FGP (in Rs. Cr.)
Fiberweb India,Yearly Results of Fiberweb India (in Rs. Cr.)
FICS Consultanc,Yearly Results of FICS Consultancy Services (in Rs. Cr.)
Fidel Softech,Yearly Results of Fidel Softech (in Rs. Cr.)
FIEM Ind,Yearly Results of FIEM Industries (in Rs. Cr.)
Filaments India,Yearly Results of Filaments India (in Rs. Cr.)
Filatex Fashion,Yearly Results of Filatex Fashions (in Rs. Cr.)
Filatex India,Yearly Results of Filatex India (in Rs. Cr.)
Filmcity Media,Yearly Results of Filmcity Media (in Rs. Cr.)
Filtra Consult,Yearly Results of Filtra Consultants and Engineers (in Rs. Cr.)
Filtron Enginee,Yearly Results of Filtron Engineers (in Rs. Cr.)
Finalysis Cr,Yearly Results of Finalysis Cr (in Rs. Cr.)
Finaventure Cap,Yearly Results of Finaventure Capital (in Rs. Cr.)
Fine Organics,Yearly Results of Fine Organics Industries (in Rs. Cr.)
Fine-line Circ,Yearly Results of Fine-line Circuits (in Rs. Cr.)
Fineotex Chem,Yearly Results of Fineotex Chemical (in Rs. Cr.)
Finkurve Fin,Yearly Results of Finkurve Financial Services (in Rs. Cr.)
Fino Payments,Yearly Results of Fino Payments Bank (in Rs. Cr.)
Finolex Cables,Yearly Results of Finolex Cables (in Rs. Cr.)
Finolex Ind,Yearly Results of Finolex Industries (in Rs. Cr.)
Fintech Comm,Yearly Results of Fintech Communication (in Rs. Cr.)
First Custodian,Yearly Results of First Custodian Fund (India) (in Rs. Cr.)
First Financial,Yearly Results of First Financial Services (in Rs. Cr.)
FIRST FINTEC,Yearly Results of FIRST FINTEC (in Rs. Cr.)
First Leasing,Yearly Results of First Leasing Company of India (in Rs. Cr.)
First Winner,Yearly Results of First Winner Industries (in Rs. Cr.)
Firstsource Sol,Yearly Results of Firstsource Solutions (in Rs. Cr.)
Fischer Inorg,Yearly Results of Fischer Inorganic and Aro (in Rs. Cr.)
Five X Tradecom,Yearly Results of Five X Tradecom (in Rs. Cr.)
Five-Star Busin,Yearly Results of Five-Star Business Finance (in Rs. Cr.)
Flair Writing,Yearly Results of Flair Writing Industries (in Rs. Cr.)
Flawless Diamon,Yearly Results of Flawless Diamond (India) (in Rs. Cr.)
Flex Foods,Yearly Results of Flex Foods (in Rs. Cr.)
Flexituff Ventu,Yearly Results of Flexituff Ventures International (in Rs. Cr.)
Flomic Global,Yearly Results of Flomic Global Logistics (in Rs. Cr.)
Flora Corporati,Yearly Results of Flora Corporation (in Rs. Cr.)
Flora Textiles,Yearly Results of Flora Textiles (in Rs. Cr.)
Florence Invest,Yearly Results of Florence Investech (in Rs. Cr.)
Fluidomat,Yearly Results of Fluidomat (in Rs. Cr.)
Foce India,Yearly Results of Foce India (in Rs. Cr.)
Focus Business,Yearly Results of Focus Business Solution (in Rs. Cr.)
Focus Ind,Yearly Results of Focus Industrial Resources (in Rs. Cr.)
Focus Lighting ,Yearly Results of Focus Lighting & Fixtures (in Rs. Cr.)
Focus Suits Sol,Yearly Results of Focus Suits Solutions & Services Ltd. (in Rs. Cr.)
Fomento Resorts,Yearly Results of Fomento Resorts and Hotels (in Rs. Cr.)
Fone4 Comm,Yearly Results of Fone4 Communications India (in Rs. Cr.)
Foods and Inns,Yearly Results of Foods and Inns (in Rs. Cr.)
Forbes Gokak,Yearly Results of Forbes Gokak (in Rs. Cr.)
Force Motors,Yearly Results of Force Motors (in Rs. Cr.)
Fortis Health,Yearly Results of Fortis Healthcare (in Rs. Cr.)
Fortis Malar,Yearly Results of Fortis Malar Hospitals (in Rs. Cr.)
Fortune Foods,Yearly Results of Fortune Foods (in Rs. Cr.)
Fortune Intl,Yearly Results of Fortune International (in Rs. Cr.)
Foseco India,Yearly Results of Foseco India (in Rs. Cr.)
Foundry Fuel,Yearly Results of Foundry Fuel Products (in Rs. Cr.)
Fourth Gen Info,Yearly Results of Fourth Generation Information Systems (in Rs. Cr.)
Franklin Ind,Yearly Results of Franklin Industries (in Rs. Cr.)
Franklin Leasin,Yearly Results of Franklin Leasing and Finance (in Rs. Cr.)
Fraser and Comp,Yearly Results of Fraser and Company (in Rs. Cr.)
Fredun Pharmace,Yearly Results of Fredun Pharmaceuticals Limited (in Rs. Cr.)
Fresenius Kabi,Yearly Results of Fresenius Kabi Oncology (in Rs. Cr.)
Freshtrop Fruit,Yearly Results of Freshtrop Fruits (in Rs. Cr.)
Frog Cellsat,Yearly Results of Frog Cellsat (in Rs. Cr.)
Frontier Cap,Yearly Results of Frontier Capital (in Rs. Cr.)
Frontier Spring,Yearly Results of Frontier Springs (in Rs. Cr.)
Frontline Finan,Yearly Results of Frontline Financial Services (in Rs. Cr.)
Frontline Sec,Yearly Results of Frontline Securities (in Rs. Cr.)
Frontline Sol,Yearly Results of Frontline Business Solutions (in Rs. Cr.)
Frontline Trans,Yearly Results of Frontline Transport (in Rs. Cr.)
Fruition Vent,Yearly Results of Fruition Venture (in Rs. Cr.)
FSN E-Co Nykaa,Yearly Results of FSN E-Commerce Ventures Nykaa (in Rs. Cr.)
Fulford,Yearly Results of Fulford (India) (in Rs. Cr.)
Fundviser,Yearly Results of Fundviser Capital (india) (in Rs. Cr.)
Funny Software,Yearly Results of Funny Software (in Rs. Cr.)
Funworld Tour,Yearly Results of Funworld And  Tour Dev. (in Rs. Cr.)
Fusion Fittings,Yearly Results of Fusion Fittings (in Rs. Cr.)
Fusion Micro,Yearly Results of Fusion Micro Finance (in Rs. Cr.)
Futura,Yearly Results of Futura Polyesters (in Rs. Cr.)
Future Consumer,Yearly Results of Future Consumer (in Rs. Cr.)
Future Ent,Yearly Results of Future Enterprises (in Rs. Cr.)
Future Ent DVR,Yearly Results of Future Enterprises DVR (in Rs. Cr.)
Future Life,Yearly Results of Future Lifestyle Fashions (in Rs. Cr.)
Future Market,Yearly Results of Future Market Networks (in Rs. Cr.)
Future Retail,Yearly Results of Future Retail (in Rs. Cr.)
Future Supply,Yearly Results of Future Supply Chain Solutions (in Rs. Cr.)
Futuristic,Yearly Results of Futuristic Offshore Services And Chem (in Rs. Cr.)
Futuristic Sec,Yearly Results of Futuristic Securities (in Rs. Cr.)
Futuristic Sol,Yearly Results of Futuristic Solutions (in Rs. Cr.)
G G Engineering,Yearly Results of G G Engineering (in Rs. Cr.)
G K P Printing,Yearly Results of G K P Printing & Packaging (in Rs. Cr.)
G R Infra,Yearly Results of G R Infraprojects (in Rs. Cr.)
G-Tec Jainx,Yearly Results of G-Tec Jainx Education (in Rs. Cr.)
G-Tech Info,Yearly Results of G-Tech Info-Training (in Rs. Cr.)
G. G. Dandekar,Yearly Results of G. G. Dandekar Properties (in Rs. Cr.)
G.D. Trading,Yearly Results of G.D. Trading & Agencies (in Rs. Cr.)
Gabriel India,Yearly Results of Gabriel India (in Rs. Cr.)
GACM Tech,Yearly Results of GACM Technologies (in Rs. Cr.)
Gaekwar Mills,Yearly Results of Gaekwar Mills (in Rs. Cr.)
Gagan Gases,Yearly Results of Gagan Gases (in Rs. Cr.)
Gagan Polycot,Yearly Results of Gagan Polycot India (in Rs. Cr.)
GAIL,Yearly Results of GAIL India (in Rs. Cr.)
Gajanan Sec,Yearly Results of Gajanan Securities Services (in Rs. Cr.)
Gajra Bevel Gea,Yearly Results of Gajra Bevel Gears (in Rs. Cr.)
Gala Global Prd,Yearly Results of Gala Global Products Ltd. (in Rs. Cr.)
Galactico Corp,Yearly Results of Galactico Corporate Services (in Rs. Cr.)
Galada Finance,Yearly Results of Galada Finance (in Rs. Cr.)
Galada Telecom,Yearly Results of Galada Power and Telecommunications (in Rs. Cr.)
Galaxy Agrico,Yearly Results of Galaxy Agrico Exports (in Rs. Cr.)
Galaxy Bearings,Yearly Results of Galaxy Bearings (in Rs. Cr.)
Galaxy Cloud,Yearly Results of Galaxy Cloud Kitchens (in Rs. Cr.)
Galaxy Commerci,Yearly Results of Latent Light Finance (in Rs. Cr.)
Galaxy Con,Yearly Results of Galaxy Consolidated (in Rs. Cr.)
Galaxy Surfacta,Yearly Results of Galaxy Surfactants Ltd. (in Rs. Cr.)
Gallantt Ispat,Yearly Results of Gallantt Ispat (in Rs. Cr.)
Gallops Ent,Yearly Results of Gallops Enterprise (in Rs. Cr.)
Galore Prints,Yearly Results of Galore Prints Industries (in Rs. Cr.)
Gamma Rays Tran,Yearly Results of Gamma Rays Transmissions (in Rs. Cr.)
Gammon India,Yearly Results of Gammon India (in Rs. Cr.)
Gandhar Oil,Yearly Results of Gandhar Oil Refinery India (in Rs. Cr.)
Gandhi Spl Tube,Yearly Results of Gandhi Special Tubes (in Rs. Cr.)
Gandhidham Spg.,Yearly Results of Gandhidham Spg. & Mfg. Co. (in Rs. Cr.)
Gandhinagar Fin,Yearly Results of Gandhinagar Leasing and Finance (in Rs. Cr.)
Gandhinagar Hot,Yearly Results of Gandhinagar Hotels (in Rs. Cr.)
Ganesh Benzo,Yearly Results of Ganesh Benzoplast (in Rs. Cr.)
Ganesh Films In,Yearly Results of Ganesh Films India (in Rs. Cr.)
Ganesh Forgings,Yearly Results of Shree Ganesh Forgings (in Rs. Cr.)
Ganesh Foundry ,Yearly Results of Ganesh Foundry & Castings (in Rs. Cr.)
Ganesh Holdings,Yearly Results of Ganesh Holdings (in Rs. Cr.)
Ganesh Housing,Yearly Results of Ganesh Housing Corporation (in Rs. Cr.)
Ganesha Ecosph,Yearly Results of Ganesha Ecosphere (in Rs. Cr.)
Ganesha Ecovers,Yearly Results of Ganesha Ecovers (in Rs. Cr.)
Ganga Forging,Yearly Results of Ganga Forging (in Rs. Cr.)
Ganga Papers,Yearly Results of Ganga Papers India (in Rs. Cr.)
Ganga Pharma,Yearly Results of Ganga Pharmaceuticals (in Rs. Cr.)
Gangadharan App,Yearly Results of Gangadharan Appliances (in Rs. Cr.)
Ganges Securiti,Yearly Results of Ganges Securities (in Rs. Cr.)
Gangotri Cement,Yearly Results of Gangotri Cement (in Rs. Cr.)
Gangotri Iron,Yearly Results of Gangotri Iron & Steel Company (in Rs. Cr.)
Gangotri Textil,Yearly Results of Gangotri Textiles (in Rs. Cr.)
Ganon Products ,Yearly Results of Ganon Products Ltd. (in Rs. Cr.)
Garbi Finvest,Yearly Results of Garbi Finvest (in Rs. Cr.)
Garden Reach Sh,Yearly Results of Garden Reach Shipbuilders & Engineers (in Rs. Cr.)
Garden Silk,Yearly Results of Garden Silk Mills (in Rs. Cr.)
Garg Furnace,Yearly Results of Garg Furnace (in Rs. Cr.)
Garlon Ind,Yearly Results of Garlon Polyfab Industries (in Rs. Cr.)
Garment Mantra,Yearly Results of Garment Mantra Lifestyle (in Rs. Cr.)
Garnet Construc,Yearly Results of Garnet Construction (in Rs. Cr.)
Garnet Intl,Yearly Results of Garnet International (in Rs. Cr.)
Garodia Chemica,Yearly Results of Garodia Chemicals (in Rs. Cr.)
Garware Marine,Yearly Results of Garware Marine Industries (in Rs. Cr.)
Garware Synth,Yearly Results of Garware Synthetics (in Rs. Cr.)
Garware Technic,Yearly Results of Garware Technical Fibres (in Rs. Cr.)
Gateway Distri,Yearly Results of Gateway Distriparks (in Rs. Cr.)
Gautam Exim,Yearly Results of Gautam Exim Ltd (in Rs. Cr.)
Gautam Gems,Yearly Results of Gautam Gems (in Rs. Cr.)
Gayatri Bio,Yearly Results of Gayatri Bioorganics (in Rs. Cr.)
Gayatri Highway,Yearly Results of Gayatri Highways (in Rs. Cr.)
Gayatri Project,Yearly Results of Gayatri Projects (in Rs. Cr.)
Gayatri Rubbers,Yearly Results of Gayatri Rubbers and Chemicals (in Rs. Cr.)
Gayatri Sugars,Yearly Results of Gayatri Sugars (in Rs. Cr.)
Gazi Fin Ser,Yearly Results of Gazi Financial Services and Investments (in Rs. Cr.)
GB Global,Yearly Results of GB Global (in Rs. Cr.)
Gccl Constr,Yearly Results of GCCL Constructions (in Rs. Cr.)
GCCL Infrastruc,Yearly Results of GCCL Infrastructure & Projects (in Rs. Cr.)
GCM Capital,Yearly Results of GCM Capital Advisors (in Rs. Cr.)
GCM Commodity,Yearly Results of GCM Commodity & Derivatives (in Rs. Cr.)
GCM Securities,Yearly Results of GCM Securities (in Rs. Cr.)
GCV Services,Yearly Results of GCV Services (in Rs. Cr.)
GDL Leasing,Yearly Results of GDL Leasing and Finance (in Rs. Cr.)
GDR Media,Yearly Results of GDR Media (in Rs. Cr.)
GE Power India,Yearly Results of GE Power India (in Rs. Cr.)
GE Shipping,Yearly Results of Great Eastern Shipping Company (in Rs. Cr.)
GE T&D India,Yearly Results of GE T&D India (in Rs. Cr.)
GEE,Yearly Results of GEE (in Rs. Cr.)
Gee Gee Granite,Yearly Results of Gee Gee Granites (in Rs. Cr.)
GeeCee Ventures,Yearly Results of GeeCee Ventures (in Rs. Cr.)
Geefcee Fin,Yearly Results of Geefcee Finance (in Rs. Cr.)
Geekay Wires,Yearly Results of Geekay Wires (in Rs. Cr.)
Geetanjali Cred,Yearly Results of Geetanjali Credit and Capital (in Rs. Cr.)
GEI Industrial,Yearly Results of GEI Industrial Systems (in Rs. Cr.)
Gem Cables,Yearly Results of Gem Cables and Conductors (in Rs. Cr.)
Gem Spinners,Yearly Results of Gem Spinners India (in Rs. Cr.)
Gemini Comm,Yearly Results of Gemini Communications (in Rs. Cr.)
Gemmia Oiltech,Yearly Results of Gemmia Oiltech (India) (in Rs. Cr.)
Gemstone Inv,Yearly Results of Gemstone Investments (in Rs. Cr.)
Genera Agri,Yearly Results of Genera Agri Corp (in Rs. Cr.)
General Insuran,Yearly Results of General Insurance Corporation of India (in Rs. Cr.)
Generic Eng,Yearly Results of Generic Engineering Construction and Projects (in Rs. Cr.)
Generic Pharmas,Yearly Results of Generic Pharmasec (in Rs. Cr.)
Genesys Int,Yearly Results of Genesys International Corporation (in Rs. Cr.)
Gennex Labs,Yearly Results of Gennex Laboratories (in Rs. Cr.)
Genomic Valley,Yearly Results of Genomic Valley Biotech (in Rs. Cr.)
Gensol Eng,Yearly Results of Gensol Engineering (in Rs. Cr.)
Genus Comm,Yearly Results of Genus Commu Trade (in Rs. Cr.)
Genus Paper,Yearly Results of Genus Paper & Boards (in Rs. Cr.)
Genus Power,Yearly Results of Genus Power Infrastructures (in Rs. Cr.)
Genus Prime Inf,Yearly Results of Genus Prime Infra (in Rs. Cr.)
Geodesic,Yearly Results of Geodesic (in Rs. Cr.)
Geojit Fin,Yearly Results of Geojit Financial Services (in Rs. Cr.)
Geologging Ind,Yearly Results of Geologging Industries (in Rs. Cr.)
Geometric,Yearly Results of Geometric (in Rs. Cr.)
Getalong Enter,Yearly Results of Getalong Enterprise (in Rs. Cr.)
GFL,Yearly Results of GFL (in Rs. Cr.)
GFL Financials,Yearly Results of GFL Financials India (in Rs. Cr.)
GG Auto Gears,Yearly Results of GG Automative Gears (in Rs. Cr.)
Ghanshyam St,Yearly Results of Ghanshyam St (in Rs. Cr.)
GHCL Textiles,Yearly Results of GHCL Textiles (in Rs. Cr.)
Ghushine Fintrr,Yearly Results of Ghushine Fintrrade Ocean (in Rs. Cr.)
GIC Housing Fin,Yearly Results of GIC Housing Finance (in Rs. Cr.)
Gilada Finance,Yearly Results of Gilada Finance & Investments (in Rs. Cr.)
Gillanders Arbu,Yearly Results of Gillanders Arbuthnot & Co (in Rs. Cr.)
Gillette India,Yearly Results of Gillette India (in Rs. Cr.)
Gilt Pack,Yearly Results of Gilt Pack (in Rs. Cr.)
Gini Silk Mills,Yearly Results of Gini Silk Mills (in Rs. Cr.)
Ginni Filaments,Yearly Results of Ginni Filaments (in Rs. Cr.)
Girdhari Sugar,Yearly Results of Girdharilal Sugar and Allied (in Rs. Cr.)
Giriraj Civil D,Yearly Results of Giriraj Civil Developers (in Rs. Cr.)
Girish Hotel,Yearly Results of Girish Hotel Resorts and Health Farm (in Rs. Cr.)
Girnar Fibres,Yearly Results of Girnar Fibres (in Rs. Cr.)
Gita Renewable ,Yearly Results of Gita Renewable Energy (in Rs. Cr.)
Gitanjali Gems,Yearly Results of Gitanjali Gems (in Rs. Cr.)
GK Consultants,Yearly Results of GK Consultants (in Rs. Cr.)
GKB Ophthalmics,Yearly Results of GKB Ophthalmics (in Rs. Cr.)
GKW,Yearly Results of GKW (in Rs. Cr.)
Glance Fin,Yearly Results of Glance Finance (in Rs. Cr.)
Gland,Yearly Results of Gland Pharma (in Rs. Cr.)
GlaxoSmith Con,Yearly Results of GlaxoSmithKline Consumer Healthcare (in Rs. Cr.)
GlaxoSmithKline,Yearly Results of GlaxoSmithKline Pharmaceuticals (in Rs. Cr.)
GLCL,Yearly Results of Gian Life Care Limited (in Rs. Cr.)
Gleam Fabmat,Yearly Results of Gleam Fabmat (in Rs. Cr.)
Gleitlager,Yearly Results of Gleitlager (India) (in Rs. Cr.)
Glenmark,Yearly Results of Glenmark Pharma (in Rs. Cr.)
Glenmark Life,Yearly Results of Glenmark Life Sciences (in Rs. Cr.)
Glittke Granite,Yearly Results of Glittke Granites (in Rs. Cr.)
Global Cap Mkts,Yearly Results of Global Capital Markets (in Rs. Cr.)
Global Educatio,Yearly Results of Global Education (in Rs. Cr.)
Global Films,Yearly Results of Global Films & Broadcasting (in Rs. Cr.)
Global Health,Yearly Results of Global Health (in Rs. Cr.)
Global Ind,Yearly Results of Global Industries (in Rs. Cr.)
Global Infra,Yearly Results of Global Infrastructure and Technologies (in Rs. Cr.)
Global Knitfab ,Yearly Results of Global Knitfab (in Rs. Cr.)
Global Land,Yearly Results of Global Land Masters Corporation (in Rs. Cr.)
Global Longlife,Yearly Results of Global Longlife Hospital and Research (in Rs. Cr.)
Global Offshore,Yearly Results of Global Offshore Services (in Rs. Cr.)
Global Pet Ind,Yearly Results of Global Pet Industries (in Rs. Cr.)
Global Sec,Yearly Results of Global Securities (in Rs. Cr.)
Global Stone,Yearly Results of Global Stone (in Rs. Cr.)
Global Surfaces,Yearly Results of Global Surfaces (in Rs. Cr.)
Global Vectra,Yearly Results of Global Vectra Helicorp (in Rs. Cr.)
Globalspace Tec,Yearly Results of Globalspace Technologies (in Rs. Cr.)
Globe Commercia,Yearly Results of Globe Commercials (in Rs. Cr.)
Globe Internati,Yearly Results of Globe International Carriers (in Rs. Cr.)
Globe Textiles,Yearly Results of Globe Textiles India (in Rs. Cr.)
Globesecure,Yearly Results of Globesecure Technologies (in Rs. Cr.)
Globus Constr,Yearly Results of Globus Constructors & Developers (in Rs. Cr.)
Globus Corp,Yearly Results of Globus Corpooration (in Rs. Cr.)
Globus Spirits,Yearly Results of Globus Spirits (in Rs. Cr.)
Glodyne Techno,Yearly Results of Glodyne Technoserve (in Rs. Cr.)
Glory Polyfilms,Yearly Results of Glory Polyfilms (in Rs. Cr.)
Glos NT,Yearly Results of Glos NT (in Rs. Cr.)
Gloster,Yearly Results of Gloster (in Rs. Cr.)
GM,Yearly Results of G M Polyplast (in Rs. Cr.)
GM Breweries,Yearly Results of GM Breweries (in Rs. Cr.)
GMM Pfaudler,Yearly Results of GMM Pfaudler (in Rs. Cr.)
GMR Airports,Yearly Results of GMR Airports Infrastructure (in Rs. Cr.)
GMRP&UI,Yearly Results of GMR Power and Urban Infra (in Rs. Cr.)
GNA Axles,Yearly Results of GNA Axles (in Rs. Cr.)
GNFC,Yearly Results of Gujarat Narmada Valley Fert & Chem. (in Rs. Cr.)
Go Fashion,Yearly Results of Go Fashion India (in Rs. Cr.)
Goa Carbon,Yearly Results of Goa Carbon (in Rs. Cr.)
Goa Fruit,Yearly Results of Goa Fruit Specialities (in Rs. Cr.)
Goblin India,Yearly Results of Goblin India (in Rs. Cr.)
GOCL Corp,Yearly Results of GOCL Corporation (in Rs. Cr.)
Godavari Drugs,Yearly Results of Godavari Drugs (in Rs. Cr.)
Godawari Power,Yearly Results of Godawari Power & Ispat (in Rs. Cr.)
Godfrey Phillip,Yearly Results of Godfrey Phillips India (in Rs. Cr.)
Godha Cabcon,Yearly Results of Godha Cabcon and Insulation (in Rs. Cr.)
Godrej Agrovet,Yearly Results of Godrej Agrovet (in Rs. Cr.)
Godrej Consumer,Yearly Results of Godrej Consumer Products (in Rs. Cr.)
Godrej Ind,Yearly Results of Godrej Industries (in Rs. Cr.)
Godrej Prop,Yearly Results of Godrej Properties (in Rs. Cr.)
Goel Food,Yearly Results of Goel Food Products (in Rs. Cr.)
Goenka Business,Yearly Results of Goenka Business & Finance (in Rs. Cr.)
